{
  "contractVersion": "1.0",
  "eventId": "event-deliver-coffee-001",
  "incidentId": "incident-daniel-coffee-001",
  "chairId": "chair-01",
  "eventType": "routine_request",
  "occurredAt": "2026-07-18T17:13:46-05:00",
  "source": "care-center-simulator",
  "evidenceRefs": ["sim-patient-request-001"],
  "routineSupport": { "item": "coffee", "preApproved": true }
}
